{
  "format": "opentrace.traffic-linear.v1",
  "feature_layout": "wall_clock_calendar5_lags_oldest_first",
  "lags": 3,
  "mean": [0.1, -0.2, 0.3, -0.4, 0.5, 100, 200, 300],
  "scale": [0.5, 1, 2, 3, 1, 10, 20, 30],
  "coefficients": [1.5, -2, 3, -0.5, 7, 0.1, 0.2, 0.3],
  "intercept": 42,
  "history": [110, 190, 330]
}
